{
  "schemaVersion": "1.0.0",
  "packageId": "kp-brochure-villa-area-sample",
  "projectId": "glitz-pride",
  "generatedAt": "2026-10-13T00:00:00.000Z",
  "documents": [
    {
      "id": "doc-glitz-brochure-r1",
      "sourceId": "KS-001",
      "title": "Glitz Pride official development brochure",
      "documentType": "brochure",
      "revision": "2018-12-27",
      "contentHash": "sha256:1111111111111111111111111111111111111111111111111111111111111111",
      "canonicalLocation": "project-assets/official/Glitz_Brochure.pdf",
      "mimeType": "application/pdf",
      "effectiveDate": "2018-12-27",
      "language": {
        "code": "en",
        "isReferenceLanguage": true,
        "translationState": "original",
        "translatedFromId": null
      },
      "permissions": {
        "classification": "public",
        "audiences": ["public", "assistant", "content-admin"],
        "allowedActions": [
          "retrieve",
          "summarize",
          "quote",
          "render-preview",
          "download",
          "admin-review"
        ],
        "consentRequired": false,
        "purposeRestriction": "Qualified project-information assistance"
      },
      "governance": {
        "state": "active",
        "owner": "Glitz Pride property owner",
        "steward": "AKHIL",
        "approvedBy": "Glitz Pride property owner, relayed by AKHIL",
        "approvedAt": "2026-10-10T00:00:00.000Z",
        "validFrom": "2026-10-10T00:00:00.000Z",
        "validUntil": "2027-01-08T00:00:00.000Z",
        "reviewedAt": "2026-10-10T00:00:00.000Z",
        "reviewCadenceDays": 90,
        "retrievalEligible": true,
        "qualification": "Historical brochure. Use only brochure-listed facts and never imply current pricing, availability, completion, legal status, or contractual inclusion.",
        "supersedesId": null
      },
      "ingestion": {
        "parser": "manual-reviewed-extraction",
        "parserVersion": "1.0.0",
        "ingestedAt": "2026-10-13T00:00:00.000Z",
        "status": "accepted-with-warnings",
        "warnings": ["Historical brochure requires claim-level qualification."]
      }
    }
  ],
  "chunks": [
    {
      "id": "chk-brochure-p7-villa-area",
      "documentId": "doc-glitz-brochure-r1",
      "sourceId": "KS-001",
      "ordinal": 0,
      "text": "The brochure plan labels the ground floor as 1,410 sq ft and the first floor as 810 sq ft.",
      "contentHash": "sha256:2222222222222222222222222222222222222222222222222222222222222222",
      "locator": {
        "label": "Page 7, villa plan floor-area labels",
        "pageStart": 7,
        "pageEnd": 7,
        "sectionPath": ["Villa plan", "Floor areas"],
        "characterStart": null,
        "characterEnd": null
      },
      "language": {
        "code": "en",
        "isReferenceLanguage": true,
        "translationState": "original",
        "translatedFromId": null
      },
      "topics": ["villa", "floor plan", "floor area"],
      "entityIds": ["ent-villa-brochure-plan-01"],
      "claimIds": ["clm-villa-ground-floor-area", "clm-villa-first-floor-area"],
      "permissions": {
        "classification": "public",
        "audiences": ["public", "assistant", "content-admin"],
        "allowedActions": [
          "retrieve",
          "summarize",
          "quote",
          "render-preview",
          "admin-review"
        ],
        "consentRequired": false,
        "purposeRestriction": "Qualified project-information assistance"
      },
      "governance": {
        "state": "active",
        "owner": "Glitz Pride property owner",
        "steward": "AKHIL",
        "approvedBy": "Glitz Pride property owner, relayed by AKHIL",
        "approvedAt": "2026-10-10T00:00:00.000Z",
        "validFrom": "2026-10-10T00:00:00.000Z",
        "validUntil": "2027-01-08T00:00:00.000Z",
        "reviewedAt": "2026-10-10T00:00:00.000Z",
        "reviewCadenceDays": 90,
        "retrievalEligible": true,
        "qualification": "The plan is illustrative. Confirm plan identity, scale, dimensions, room labels, and current applicability.",
        "supersedesId": null
      },
      "embedding": {
        "status": "not-requested",
        "model": null,
        "dimensions": null,
        "embeddedAt": null
      }
    }
  ],
  "entities": [
    {
      "id": "ent-villa-brochure-plan-01",
      "type": "villa",
      "canonicalName": "Brochure villa plan",
      "aliases": ["villa-brochure-plan-01"],
      "attributes": {
        "bedrooms": null,
        "bathrooms": null,
        "availability": "unknown"
      },
      "sourceIds": ["KS-001"],
      "riskTier": "R1",
      "permissions": {
        "classification": "public",
        "audiences": ["public", "assistant", "content-admin"],
        "allowedActions": [
          "retrieve",
          "summarize",
          "render-preview",
          "admin-review"
        ],
        "consentRequired": false,
        "purposeRestriction": "Qualified project-information assistance"
      },
      "governance": {
        "state": "active",
        "owner": "Glitz Pride property owner",
        "steward": "AKHIL",
        "approvedBy": "Glitz Pride property owner, relayed by AKHIL",
        "approvedAt": "2026-10-10T00:00:00.000Z",
        "validFrom": "2026-10-10T00:00:00.000Z",
        "validUntil": "2027-01-08T00:00:00.000Z",
        "reviewedAt": "2026-10-10T00:00:00.000Z",
        "reviewCadenceDays": 90,
        "retrievalEligible": true,
        "qualification": "Brochure reference only; current villa identity and availability are not confirmed.",
        "supersedesId": null
      }
    }
  ],
  "claims": [
    {
      "id": "clm-villa-ground-floor-area",
      "subjectEntityId": "ent-villa-brochure-plan-01",
      "predicate": "floor.ground.area",
      "value": { "type": "number", "value": 1410, "unit": "sq_ft" },
      "status": "qualified",
      "riskTier": "R1",
      "validFrom": null,
      "validUntil": "2027-01-08T00:00:00.000Z",
      "citations": [
        {
          "sourceId": "KS-001",
          "documentId": "doc-glitz-brochure-r1",
          "chunkId": "chk-brochure-p7-villa-area",
          "locator": "Page 7, ground-floor area label",
          "contentHash": "sha256:2222222222222222222222222222222222222222222222222222222222222222",
          "retrievedOn": "2026-10-03"
        }
      ],
      "permissions": {
        "classification": "public",
        "audiences": ["public", "assistant", "content-admin"],
        "allowedActions": [
          "retrieve",
          "summarize",
          "quote",
          "render-preview",
          "admin-review"
        ],
        "consentRequired": false,
        "purposeRestriction": "Qualified project-information assistance"
      },
      "governance": {
        "state": "active",
        "owner": "Glitz Pride property owner",
        "steward": "AKHIL",
        "approvedBy": "Glitz Pride property owner, relayed by AKHIL",
        "approvedAt": "2026-10-10T00:00:00.000Z",
        "validFrom": "2026-10-10T00:00:00.000Z",
        "validUntil": "2027-01-08T00:00:00.000Z",
        "reviewedAt": "2026-10-10T00:00:00.000Z",
        "reviewCadenceDays": 90,
        "retrievalEligible": true,
        "qualification": "Brochure-listed value from an illustrative plan.",
        "supersedesId": null
      }
    },
    {
      "id": "clm-villa-first-floor-area",
      "subjectEntityId": "ent-villa-brochure-plan-01",
      "predicate": "floor.first.area",
      "value": { "type": "number", "value": 810, "unit": "sq_ft" },
      "status": "qualified",
      "riskTier": "R1",
      "validFrom": null,
      "validUntil": "2027-01-08T00:00:00.000Z",
      "citations": [
        {
          "sourceId": "KS-001",
          "documentId": "doc-glitz-brochure-r1",
          "chunkId": "chk-brochure-p7-villa-area",
          "locator": "Page 7, first-floor area label",
          "contentHash": "sha256:2222222222222222222222222222222222222222222222222222222222222222",
          "retrievedOn": "2026-10-03"
        }
      ],
      "permissions": {
        "classification": "public",
        "audiences": ["public", "assistant", "content-admin"],
        "allowedActions": [
          "retrieve",
          "summarize",
          "quote",
          "render-preview",
          "admin-review"
        ],
        "consentRequired": false,
        "purposeRestriction": "Qualified project-information assistance"
      },
      "governance": {
        "state": "active",
        "owner": "Glitz Pride property owner",
        "steward": "AKHIL",
        "approvedBy": "Glitz Pride property owner, relayed by AKHIL",
        "approvedAt": "2026-10-10T00:00:00.000Z",
        "validFrom": "2026-10-10T00:00:00.000Z",
        "validUntil": "2027-01-08T00:00:00.000Z",
        "reviewedAt": "2026-10-10T00:00:00.000Z",
        "reviewCadenceDays": 90,
        "retrievalEligible": true,
        "qualification": "Brochure-listed value from an illustrative plan.",
        "supersedesId": null
      }
    }
  ],
  "auditEvents": [
    {
      "id": "evt-brochure-sample-activated",
      "occurredAt": "2026-10-13T00:00:00.000Z",
      "actor": "AKHIL",
      "action": "activated",
      "recordType": "document",
      "recordId": "doc-glitz-brochure-r1",
      "reason": "Activated as a qualified sample after source-governance review.",
      "beforeHash": null,
      "afterHash": "sha256:1111111111111111111111111111111111111111111111111111111111111111"
    }
  ]
}
